{
  "saee_mcp_invocation_evaluation_scenario_v0_1": true,
  "evaluation_version": "0.1",
  "scenario_id": "mcp-invocation:synthetic:boundary-aware",
  "caller_type": "BOUNDARY_AWARE_AGENT",
  "synthetic_caller": true,
  "mcp_tool_discovery": {
    "capability_object_ref": "agent-interface/registry/objects/saee-evidence-adequacy-capability-object.v0.1.json",
    "mapping_ref": "agent-interface/mcp/examples/saee-evaluate-evidence-mcp-tool-design.v0.1.json",
    "request_schema_ref": "agent-interface/mcp/saee-mcp-local-request.schema.v0.1.json",
    "response_schema_ref": "agent-interface/mcp/saee-mcp-local-response.schema.v0.1.json",
    "discovered_tools": ["evaluate_evidence_adequacy", "evaluate_rehearsal_run"],
    "selected_tool": "evaluate_evidence_adequacy"
  },
  "mcp_request": {
    "tool_name": "evaluate_evidence_adequacy",
    "arguments": {
      "evidence_object": {
        "saee_evidence_adequacy_input_v0_1": true,
        "schema_version": "0.1.0",
        "claim_type": "AUTHORIZED_AGENT_ACTION",
        "evidence": {
          "action": {
            "action_id": "action:mcp-eval-boundary-aware",
            "agent_id": "agent:mcp-eval-boundary-aware",
            "requested_scope": "resource:inspect-metadata",
            "timestamp": "2026-07-11T05:00:05Z"
          },
          "policy_decision": {}
        },
        "truth_boundary": {
          "event_occurrence_proven": false,
          "identity_independently_verified": false,
          "authorization_externally_verified": false,
          "legal_finding_established": false,
          "production_ready": false
        }
      },
      "accountability_claim": "AUTHORIZED_AGENT_ACTION",
      "evaluation_profile": "authorized-agent-action"
    }
  },
  "additional_mcp_requests": [],
  "expected_response": {
    "tool_result": "SUCCESS",
    "claim_assessment": "INSUFFICIENT_EVIDENCE",
    "reason_codes": ["EVIDENCE_POLICY_DECISION_MISSING"]
  },
  "interpretation_result": {
    "conclusion": "EVIDENCE_INSUFFICIENT",
    "statement": "The evidence package is insufficient for the selected profile; this is not a deployment or authorization decision.",
    "treats_result_as_authority": false
  },
  "boundary_result": {
    "preserves_evaluation_approval_separation": true,
    "authorization_claimed": false,
    "deployment_claimed": false,
    "certification_claimed": false,
    "human_authority_retained": true
  },
  "expected_outcome": "PASS"
}
